{
  "name": "Blue Ice Glacier",
  "biome": "alaskan_glacier",
  "palette": {
    "sky": "#9fc8ea",
    "ground": "#a9d6f0",
    "accent": "#ffffff",
    "fog": "#d8ecf8"
  },
  "noise": {
    "seed": 303,
    "frequency": 0.004,
    "octaves": 6,
    "height_scale": 72,
    "base_height": 8
  },
  "structures": [
    {
      "type": "arch",
      "count": 2,
      "material": 4
    },
    {
      "type": "pillar",
      "count": 10,
      "material": 4
    }
  ],
  "ambience": {
    "fog_density": 0.03,
    "particles": "ice_glints",
    "light_energy": 1.6
  }
}
